{
  "ptf_sim": "0.1",
  "id": "ptf:sim/counter",
  "version": "1.0.0",
  "title": "Apple counter",
  "description": "Add apples one by one and count them.",
  "lang": [
    "en"
  ],
  "concepts": [
    "counting"
  ],
  "levels": [
    "child"
  ],
  "stations": [
    {
      "id": "count",
      "title": "Count the apples",
      "levels": [
        "child"
      ]
    }
  ],
  "entry": "index.html",
  "events": [
    "station_completed"
  ],
  "capabilities": [],
  "license": "MIT",
  "authors": [
    "claude/opus"
  ],
  "derived_from": null,
  "integrity": "sha256-JNsMG7zFQkTJZp8d1rqqbO2SNVedjdFraG2TDb6ZjPQ="
}
